{
  "apiVersion": "researchos.dev/v0alpha1",
  "kind": "MacMpsTrainingPlan",
  "backendId": "ms-swift",
  "backendVersion": "4.5.2",
  "model": "Qwen/Qwen2.5-0.5B-Instruct",
  "modelRevision": "7ae557604adf67be50417f59c2c2f167def9a775",
  "modelType": "qwen2",
  "template": "qwen2_5",
  "dataset": "data/sft.jsonl",
  "tunerType": "lora",
  "torchDtype": "float32",
  "accDevice": "mps",
  "maxSteps": 20,
  "perDeviceTrainBatchSize": 1,
  "gradientAccumulationSteps": 1,
  "learningRate": "1e-4",
  "loraRank": 8,
  "loraAlpha": 16,
  "outputDir": "output",
  "saveSteps": 10,
  "loggingSteps": 1,
  "maxLength": 256,
  "seed": 42
}
